{
    "sessionId": "20260307-061500",
    "requirementRef": "REQ-20260307-061500",
    "currentState": "DELIVERED",
    "reworkCount": 0,
    "history": [
        {
            "from": "NONE",
            "to": "INTAKE",
            "timestamp": "2026-03-07T06:15:00Z",
            "gate": "N/A",
            "notes": "Dry-run session created"
        },
        {
            "from": "INTAKE",
            "to": "PM_ANALYSIS",
            "timestamp": "2026-03-07T06:15:01Z",
            "gate": "N/A",
            "notes": "Request recorded"
        },
        {
            "from": "PM_ANALYSIS",
            "to": "CTO_PLANNING",
            "timestamp": "2026-03-07T06:15:10Z",
            "gate": "Gate①",
            "notes": "Requirement package complete"
        },
        {
            "from": "CTO_PLANNING",
            "to": "EXECUTION",
            "timestamp": "2026-03-07T06:15:20Z",
            "gate": "Gate②",
            "notes": "Plan + DAG approved"
        },
        {
            "from": "EXECUTION",
            "to": "QA_VERIFICATION",
            "timestamp": "2026-03-07T06:15:30Z",
            "gate": "Gate③",
            "notes": "All manifests submitted"
        },
        {
            "from": "QA_VERIFICATION",
            "to": "JOINT_APPROVAL",
            "timestamp": "2026-03-07T06:15:40Z",
            "gate": "Gate④",
            "notes": "5-layer PASS"
        },
        {
            "from": "JOINT_APPROVAL",
            "to": "DELIVERED",
            "timestamp": "2026-03-07T06:15:50Z",
            "gate": "Gate⑤",
            "notes": "CTO+PM dual approve"
        }
    ]
}